,company,Designation,title,rating,review,date,Place
1,Meta,Software Engineer (Former Employee) ,A great place to learn and improve oneself,"<button aria-describedby=""cmp-rating-tooltip-1e9aclnuopifv800"" aria-label=""5.0 out of 5 stars."" class=""css-1c33izo e1wnkr790"">5.0</button>","Working at Facebook exposes you to problems seldom seen anywhere else simply based on the sheer scale of products. The company cares about its employees and makes sure that they provide all the tools to achieve maximum productivity and efficiency from them."," May 27, 2020", New York 
2,Meta,Software Engineer (Former Employee) ,Becoming worse,"<button aria-describedby=""cmp-rating-tooltip-1g1etgfvus7eh800"" aria-label=""3.0 out of 5 stars."" class=""css-1c33izo e1wnkr790"">3.0</button>","I have joined the company since 2018 and enjoyed many benefits but since a couple a years, there seems to be a trend where people are less and less reliable when you need to be accountable as if you failing makes them happy.Don't share more than necessary and succeed."," April 24, 2022", California 
3,Meta,PM (Former Employee) ,"Standard big-tech job, with the pros and cons that come with that. ","<button aria-describedby=""cmp-rating-tooltip-1g1efo0aonpki800"" aria-label=""5.0 out of 5 stars."" class=""css-1c33izo e1wnkr790"">5.0</button>","Great if you're looking for a big tech job, less great if you're looking for something super scrappy and entrepreneurial. Overall, a solid opportunity. "," April 24, 2022"," Menlo Park, CA "
4,Meta,Program Manager (Former Employee) ,Productive and fun environment ,"<button aria-describedby=""cmp-rating-tooltip-1g17gl7rjnq3m802"" aria-label=""5.0 out of 5 stars."" class=""css-1c33izo e1wnkr790"">5.0</button>",It is a great company to work for. I had a pretty good work-life balance and interesting projects. The team was supportive^ really smart people work there. Unfortunately I started and finished during the pandemic so I don't have in-person experience with the team and never visited the office.," April 21, 2022"," Seattle, WA "
5,Meta,Manager (Current Employee) ,Love working at Meta!,"<button aria-describedby=""cmp-rating-tooltip-1g03bq9cjk24g802"" aria-label=""5.0 out of 5 stars."" class=""css-1c33izo e1wnkr790"">5.0</button>","I’ve been at Meta (previously Facebook) for a few years & overall love it. My team is very close & supportive. I’ve been able to learn a ton and really grow into the role. Meta is a high performance culture so I constantly feel pushed to be better which has been good for my growth but it can lead to some long weeks & mentally tiring.The compensation is very generous compared to my previous role outside of tech. The only con is that the org can be very political (as is true for most big companies) which leads to frustration & as we’ve grown benefits have started to shift. Overall though, the company puts a lot of investment in helping its employees feel fulfilled in their role & if you focus on impact your work will be rewarded."," April 7, 2022"," Austin, TX "
6,Meta,Policy Manager (Current Employee) ,"Innovative company, but suffers from some chaos","<button aria-describedby=""cmp-rating-tooltip-1fvmdshpmgsp4800"" aria-label=""3.0 out of 5 stars."" class=""css-1c33izo e1wnkr790"">3.0</button>","I am in a non-tech role at Meta. It is exciting to be at the forefront of some exciting new innovations in the tech space, but the company's structure (or lack thereof) leads to a bit of frustrating chaos that could benefit from a leader early on (rather than the bottom-up development that's common now). Otherwise, the people are great, and the amenities and benefits are hard to beat. I pay very little for health care, and can have all three meals for free if I am in the office. The atmosphere is also flexible with coming in versus working at home, though this may be team-dependent. The performance review system leaves a lot to be desired; there is a lot of pressure to make measurable ""impact,"" and some roles just don't function that way and are more reactive."," April 2, 2022", United States 
7,Meta,Financial Analyst (Former Employee) ,Great Experience,"<button aria-describedby=""cmp-rating-tooltip-1fupoa3diq0vq800"" aria-label=""5.0 out of 5 stars."" class=""css-1c33izo e1wnkr790"">5.0</button>","I learned a lot working at Meta (now Facebook). The team is full of incredibly talented, hard-working people and I see big things ahead for the company. "," March 22, 2022"," San Francisco, CA "
8,Meta,Manager (Current Employee) ,great place to work,"<button aria-describedby=""cmp-rating-tooltip-1fuf9k4jgm6hd801"" aria-label=""5.0 out of 5 stars."" class=""css-1c33izo e1wnkr790"">5.0</button>",love it here. working on interesting things. Lots of opportunities for advancement. Culture is supportive and inclusive. Transparent communication at all levels. ," March 18, 2022"," San Francisco, CA "
9,Meta,Engineer (Former Employee) ,Na,"<button aria-describedby=""cmp-rating-tooltip-1fl8tsrgsu1l4802"" aria-label=""5.0 out of 5 stars."" class=""css-1c33izo e1wnkr790"">5.0</button>",Standard 401K benefits. I believe it was a 50/50 match. You could borrow against it and pay back. It was through Principal. They had a really good online portal where you could see everything.," November 24, 2021", Remote 
10,Meta,Brand Influencer (Current Employee) ,Fun tech job,"<button aria-describedby=""cmp-rating-tooltip-1fjog6se2t4bb800"" aria-label=""5.0 out of 5 stars."" class=""css-1c33izo e1wnkr790"">5.0</button>",Love educating customers in store wish we could give actual product demos of the oculus quest 2. Was easy to sell such a fun product. Had to wait for access to the keys to unlock cabinet for customers but that wasn't a big problem because I moved so fast. ," November 5, 2021"," Lakeland, FL "
11,Meta,Contingent Worker (Current Employee) ,Toxic Work-LIfe Balance and Endless Internal Politics. ,"<button aria-describedby=""cmp-rating-tooltip-1fj1th8iuu3rh801"" aria-label=""1.0 out of 5 stars."" class=""css-1c33izo e1wnkr790"">1.0</button>","Minuses:- Manager who micromanages work product, while exhorting me to bring my own ideas.- Any change from previous work is punished.- Invisible internal politics and friction between product and research stalls projects. - Constant emphasis on rush that causes misaligned projects.  Pluses:- Pay is great.  Contingent Worker / UX Research."," October 27, 2021", Remote 
12,Meta,Graveyard manager promotion at 1 year (Current Employee) ,Good place to work,"<button aria-describedby=""cmp-rating-tooltip-1fi9rps15o1fk800"" aria-label=""5.0 out of 5 stars."" class=""css-1c33izo e1wnkr790"">5.0</button>","What you would expect from a large company. The people are nice and great facilities. No complaints, they were always keeping things interesting day to day."," October 18, 2021"," Eagle Mountain, UT "
13,Meta,Consultant (Former Employee) ,Not my cup of tea,"<button aria-describedby=""cmp-rating-tooltip-1fh7hectlu2l5802"" aria-label=""1.0 out of 5 stars."" class=""css-1c33izo e1wnkr790"">1.0</button>",Facebook will end the world. We’re doomed. I didn’t think moral corruption was possible at this level. The leadership only cares about what puts money in their pockets. ," October 5, 2021", Remote 
14,Meta,Software Engineer (Current Employee) ,"Very strong job culture, also had a relaxed schedule.","<button aria-describedby=""cmp-rating-tooltip-1fgsc6haun5cv800"" aria-label=""5.0 out of 5 stars."" class=""css-1c33izo e1wnkr790"">5.0</button>",Facebook was a great fit for me I simply wanted a better paying position. I would love to work in a familiar job environment.                         ," September 30, 2021"," Houston, TX "
15,Meta,Data Scientist (Former Employee) ,Good pay ,"<button aria-describedby=""cmp-rating-tooltip-1ff7d7ib1308t002"" aria-label=""5.0 out of 5 stars."" class=""css-1c33izo e1wnkr790"">5.0</button>",A lot of workGood pay Smart people - so smart you feel pressured Supportive managers but they got their hands full;What else to say? Just a job.  ," September 10, 2021"," Menlo Park, CA "
16,Meta,Manager (Former Employee) ,Good place to work as a noob (out of school),"<button aria-describedby=""cmp-rating-tooltip-1feoide7st4ep802"" aria-label=""3.0 out of 5 stars."" class=""css-1c33izo e1wnkr790"">3.0</button>","Do you believe in their mission and the direction they are going and actions (corrective) they have taken?It started out as connecting people together and bringing the world together, which is fine.  Now it seems they want you to be in their metaverse universe where you create a “twin” of yourself in the internet so you can live and also conduct commerce and be bombarded with ads.No thanks!"," September 4, 2021"," Fremont, CA "
17,Meta,Engin (Former Employee) ,Decent place to work.,"<button aria-describedby=""cmp-rating-tooltip-1femnmrb3t4e2800"" aria-label=""3.0 out of 5 stars."" class=""css-1c33izo e1wnkr790"">3.0</button>",A lot of benefits and the salary is good. It is a good place for fast growth. You work on great projects and the management is actually pretty good.  ," September 3, 2021", California 
18,Meta,Administrative Assistant (Former Employee) ,"Fun place to work, good pay","<button aria-describedby=""cmp-rating-tooltip-1fd8jl2sv3h80002"" aria-label=""3.0 out of 5 stars."" class=""css-1c33izo e1wnkr790"">3.0</button>","Fun place to work, good pay, contractors get treated very badly. Management always cover themselves and don’t care about supporting the team. 3 Free meals a day, time off is hard to get. "," August 16, 2021", New York State 
19,Meta,Receptionist (Current Employee) ,Great place to work ,"<button aria-describedby=""cmp-rating-tooltip-1fc2o6nasqelk800"" aria-label=""5.0 out of 5 stars."" class=""css-1c33izo e1wnkr790"">5.0</button>",I love working here. It has changed my life and given me many amazing professional and person life experiences to live by. I left due to relocation but recommend anyone to work here !," August 2, 2021"," Menlo Park, CA "
20,Meta,Data Scientist (Current Employee) ,Good place to work,"<button aria-describedby=""cmp-rating-tooltip-1fbkq758833ie001"" aria-label=""4.0 out of 5 stars."" class=""css-1c33izo e1wnkr790"">4.0</button>",people work with are smart and helpful. Job is challenging but with good support. good pay and benefits. easy internal transfer policy. overall a good place to work for.," July 27, 2021"," Menlo Park, CA "
21,Meta,Coder I (Former Employee) ,good company,"<button aria-describedby=""cmp-rating-tooltip-1fbfoj4lqs7nl801"" aria-label=""5.0 out of 5 stars."" class=""css-1c33izo e1wnkr790"">5.0</button>",very clear annd honest company. it is vert easy to rise through your job. tht is why it is one of the most important place to work. go ahead. you will not regret.," July 25, 2021"," Boston, MA "
22,Deloitte,Senior Technical Product Manager (Current Employee) ,Great place to start your career as there are opportunities to learn and develop network.,"<button aria-describedby=""cmp-rating-tooltip-1g0ve4ans2hg7000"" aria-label=""5.0 out of 5 stars."" class=""css-1c33izo e1wnkr790"">5.0</button>","I have come across the most hard working and knowledgable bunch of individuals and learned a great deal working side by side them. Folks are really smart and can articulate complex situations in a simple easy to understand language. It is a great place to work if you want to progress your career as a consultant. However, not the right place to advance product management career. I am a Sr. Product Manager with more than seven years of experience. I was lucky to get great opportunities to express my passion for product management however from long term career perspective this is not the right place. "," April 18, 2022"," New York, NY "
23,Deloitte,Solutions Specialist (Current Employee) ,Great compensation. The USDC office has built a great culture and prioritizes work-life balance.,"<button aria-describedby=""cmp-rating-tooltip-1g1c1pf66npm2802"" aria-label=""4.0 out of 5 stars."" class=""css-1c33izo e1wnkr790"">4.0</button>","Great compensation. The USDC office has built a great culture and prioritizes work-life balance. You have endless resources for professional development. If you’re client-facing, your manager and/or team lead will vary by project. Some are great leaders while others are ineffective. Medical benefits at this level are average."," April 23, 2022"," Gilbert, AZ "
24,Deloitte,Senior Manager (Current Employee) ,Good work life balance. Lot to learn. Meaningful work.,"<button aria-describedby=""cmp-rating-tooltip-1g1bt9qm0ghq5802"" aria-label=""4.0 out of 5 stars."" class=""css-1c33izo e1wnkr790"">4.0</button>",Deloitte is a nice place to start and build a career. There are ample opportunities to learn. Employees are treated respectfully and leadership stresses on work life balance.   ," April 23, 2022"," Dallas, TX "
25,Deloitte,Associate (Former Employee) ,"very long working hours, and there's no slack/peak season now","<button aria-describedby=""cmp-rating-tooltip-1g150apfrnpot800"" aria-label=""3.0 out of 5 stars."" class=""css-1c33izo e1wnkr790"">3.0</button>","I work in China mainland office, and its duty basically is to serve HK office. We work almost the same hours, but HK pay much more than it in mainland.so i dun suggest big 4 dreamer inaugurated in mainland offices.ppl here, esp mgt, are mostly insane because yr and yr long working hours and disrespect from clients "," April 20, 2022"," China, TX "
26,Deloitte,Manager (Former Employee) ,"place to accelerate in growth, smartest colleagues and found my tribe","<button aria-describedby=""cmp-rating-tooltip-1g147n3nunprc800"" aria-label=""4.0 out of 5 stars."" class=""css-1c33izo e1wnkr790"">4.0</button>","You drown or swim type of learning experience. I came in as an experienced hire, so content wise was very strong and able to provide to my colleagues and clients. My personal growth accelerated in the 3 years I've been there. Will not be where I am without the Deloitte experience and name on my resume. I loved the people I worked with, many of them became good friends. If you are ambitious, up for the challenge and eager to grow and not afraid of a fast pace environment, this is the place for you. "," April 20, 2022", Europe  
27,Deloitte,Consultant (Former Employee) ,Not great not terrible ,"<button aria-describedby=""cmp-rating-tooltip-1g10q8v62t4e6801"" aria-label=""3.0 out of 5 stars."" class=""css-1c33izo e1wnkr790"">3.0</button>",Lot of overtime and unrecognised for part of the management. You will only be promoted to upper positions if you kiss assess.  ," April 19, 2022"," Barcelona Point, NY "
28,Deloitte,Staff Accountant (Former Employee) ,Productive ,"<button aria-describedby=""cmp-rating-tooltip-1g0uptv9jghrm802"" aria-label=""5.0 out of 5 stars."" class=""css-1c33izo e1wnkr790"">5.0</button>","Assigned to job, work with new ppl all the time ,learning all the time. Long hours , but like a graduate school in terms of learning the ropes at large companies"," April 18, 2022"," Phoenix, AZ "
29,Deloitte,SA (Current Employee) ,Incredible experience. The best decision I have made in my career was to join the firm.,"<button aria-describedby=""cmp-rating-tooltip-1g0lmibbft4e6802"" aria-label=""5.0 out of 5 stars."" class=""css-1c33izo e1wnkr790"">5.0</button>","Solid company. Amazing, talented people. DEI. Resourceful. Great learning experiences. Dynamic work environment. Many growth opportunities are available in verticals of interest."," April 14, 2022"," Washington, DC "
30,Deloitte,Logistics Specialist (Current Employee) ,Overall good company,"<button aria-describedby=""cmp-rating-tooltip-1g0ij6rjat4i2802"" aria-label=""4.0 out of 5 stars."" class=""css-1c33izo e1wnkr790"">4.0</button>","Lots of long term employee, stable company, pays well, but depending on the team you are put in you can either have a fantastic manager or an awful manager. Tired of corporate america going to work for myself!"," April 13, 2022", Remote 
31,Deloitte,Manager (Former Employee) ,Ok place to work,"<button aria-describedby=""cmp-rating-tooltip-1g0cki8ucgsqf800"" aria-label=""4.0 out of 5 stars."" class=""css-1c33izo e1wnkr790"">4.0</button>",Not a bad place to start a career (or jump start one) but I didn’t feel very fulfilled in my projects and not always a lot of support. This is team dependent but the lack of consistency is definitely something to keep in mind if you’re thinking of applying to Deloitte.," April 11, 2022"," Austin, TX "
32,Deloitte,Auditor (Current Employee) ,Stressful work environment ,"<button aria-describedby=""cmp-rating-tooltip-1g08nkjhnsa70801"" aria-label=""4.0 out of 5 stars."" class=""css-1c33izo e1wnkr790"">4.0</button>","I would give an over all rating for this company in the following:Good benefit , pay is  ok but stressful environment. Career advancement available. "," April 9, 2022"," New York, NY "
33,Deloitte,Accountant (Former Employee) ,Nice place to work,"<button aria-describedby=""cmp-rating-tooltip-1fvo1fap2s7ll800"" aria-label=""5.0 out of 5 stars."" class=""css-1c33izo e1wnkr790"">5.0</button>","Fast paced environment, beautiful offices, great colleagues and possibility to evolve, high turnover but young and talented team. Flexibility and you can get a car"," April 3, 2022"," Brussels, IL "
34,Deloitte,Senior Consultant (Current Employee) ,Great Opportunities but rife with needlessly dysfunctional processes and comms,"<button aria-describedby=""cmp-rating-tooltip-1fvk80t9mgsp4801"" aria-label=""4.0 out of 5 stars."" class=""css-1c33izo e1wnkr790"">4.0</button>","Pros*Good pay, benefits and hours for gov. consulting*Most respected, large gov. consulting practice*Lower level coworkers are often cool*Incredible breadth of offeringsCons*Consultants are expected to have 'extra-curricular' work beyond client work, where no one is focused or responsive because it's not their main job. Often feels like your client work isn't as important as winning the favor of various company managers who know nothing of your main job (the client work)*Terrible onboarding experience if you're not staffed to a project - you have to cold email/call en masse instead of talent reps helping you*Senior management pretends to be engaged and in control on client accounts but isn't, leaving a vacuum of decisive action*Internal company documentation and communication of policies and resources is awful, causes lots of confusion and frustration; you're expected to network your way past the company's dysfunctional processes*Too many company resources spent on borderline pointless lectures and meetings instead of decisive action and quality tools/documentation"," April 1, 2022"," Washington, DC "
35,Deloitte,Pursuit Manager. (Former Employee) ,The land of drama,"<button aria-describedby=""cmp-rating-tooltip-1fvjeattsm6op800"" aria-label=""2.0 out of 5 stars."" class=""css-1c33izo e1wnkr790"">2.0</button>","There ARE some good people here, but by and large the firm is dominated by egotistical drama queens who think they can only advance by throwing you under the bus when your back is turned."," April 1, 2022"," Dallas, TX "
36,Deloitte,Office Administrator (Current Employee) ,Lots of great benefits! ,"<button aria-describedby=""cmp-rating-tooltip-1fvhgbbocs7ll802"" aria-label=""5.0 out of 5 stars."" class=""css-1c33izo e1wnkr790"">5.0</button>",Great benefits they truly do care about their employees! Need to do better with work / life fit balance. Need to offer more for the working moms and instead of just preaching it actually practice it!," March 31, 2022"," New York, NY "
37,Deloitte,Teacher (Former Employee) ,It’s was ok,"<button aria-describedby=""cmp-rating-tooltip-1fvec3ilht468801"" aria-label=""1.0 out of 5 stars."" class=""css-1c33izo e1wnkr790"">1.0</button>",Wonder full job love going there everyday and putting in work loving the staff is great love the respect and the environment great pay sec in the back," March 30, 2022"," Miami, FL "
38,Deloitte,Internship on innovation and ICT (Former Employee) ,fun and inspiring workplace,"<button aria-describedby=""cmp-rating-tooltip-1fvd836dpt4m7802"" aria-label=""5.0 out of 5 stars."" class=""css-1c33izo e1wnkr790"">5.0</button>","a lot of resources at disposal for skilling up, the company encourages conferences attendance. a lot of teammates invites for exchanges over a meal or a cup, liked the meet and mingle activities"," March 30, 2022"," Arlington, VA "
39,Deloitte,Product Delivery Specialist (Current Employee) ,Depends what path you take,"<button aria-describedby=""cmp-rating-tooltip-1fv8r4hu1t46t800"" aria-label=""3.0 out of 5 stars."" class=""css-1c33izo e1wnkr790"">3.0</button>","It all depends on which path you take, either Project Delivery, Specialist, or Consulting.  Each has its own perks and drawbacks.  In Project Delivery, you need to have 90% utilization and hoildays count against that percentage which really makes it hard for you to use the generous amount of PTO they offer."," March 28, 2022", Remote 
40,Deloitte,Semi Senior de Auditoría (Former Employee) ,Buen ambiente de trabajo ,"<button aria-describedby=""cmp-rating-tooltip-1fuvaf7u42m6t002"" aria-label=""5.0 out of 5 stars."" class=""css-1c33izo e1wnkr790"">5.0</button>",Excelente equipo y excelente sueldo. Buen ambiente laboral ," March 24, 2022", Semi senior de auditoría  
41,Deloitte,Consultant (Current Employee) ,Good place to work,"<button aria-describedby=""cmp-rating-tooltip-1furv965nnptr800"" aria-label=""4.0 out of 5 stars."" class=""css-1c33izo e1wnkr790"">4.0</button>",Good place to work career growth and opportunities a lot of things to learn hikes variable pay compensation benefits are good management is good and understanding," March 23, 2022", Indiana 
42,Deloitte,Sr. Manager (Current Employee) ,Deloitte is a great company to work for,"<button aria-describedby=""cmp-rating-tooltip-1ful1v33hu2kp801"" aria-label=""5.0 out of 5 stars."" class=""css-1c33izo e1wnkr790"">5.0</button>",Deloitte is a strong global company that does great work and cares about its people.Prior to Deloitte I had never stayed at one company for more than about 5 years.It’s been 10 years at Deloitte and I will likely stay there here until  I retire.," March 20, 2022"," Hermitage, TN "
43,Comcentric,Dispatcher /Scheduler (Former Employee) ,Great place to work,"<button aria-describedby=""cmp-rating-tooltip-1eia1ado1olck800"" aria-label=""4.0 out of 5 stars."" class=""css-1c33izo e1wnkr790"">4.0</button>",It was a great place to work. Friendly environment.management were very helpful and there if you need anything. I would recommend this company to  friends.," September 15, 2020"," Wake Forest, NC "
44,Comcentric,Bookkeeper (Current Employee) ,Actively recruits employees to work for clients.,"<button aria-describedby=""cmp-rating-tooltip-1dvuh8slvbmlg801"" aria-label=""5.0 out of 5 stars."" class=""css-1c33izo e1wnkr790"">5.0</button>",Quick turnaround with clean background. Offers positions with competitive wages. Great people to work with. Care about employees. Great views of the Rocky Mountains.," January 31, 2020"," Lone Tree, CO "
45,Comcentric,SOFTWARE ENGINEER (Former Employee) ,Great employer,"<button aria-describedby=""cmp-rating-tooltip-1cd0679ns1agr219"" aria-label=""5.0 out of 5 stars."" class=""css-1c33izo e1wnkr790"">5.0</button>",They were very good as an employer and I would happily work for them in the future.  Very accommodating with any needed assistance.  I recommend they be considered as a top Colorado employer," May 8, 2018", Consultant 
46,Comcentric,Bookkeeper (Former Employee) ,"Owner micro-manages, yells at employees","<button aria-describedby=""cmp-rating-tooltip-1c7cd0hemakj4bcr"" aria-label=""2.0 out of 5 stars."" class=""css-1c33izo e1wnkr790"">2.0</button>","The employees are nice people, but the owner is not. One day he doesn't pay attention to anything, the next day he's yelling at you because something wasn't done his way. It's his way or the highway. He always has to be right."," February 27, 2018"," Lone Tree, CO "
47,Comcentric,Tech Service Center IP Tier (Current Employee) ,Great people...,"<button aria-describedby=""cmp-rating-tooltip-196bsppp6ak4gapo"" aria-label=""5.0 out of 5 stars."" class=""css-1c33izo e1wnkr790"">5.0</button>","I must admit that i do not like working as a contractor, however Comcentric made very easy."," November 9, 2014"," Broomfield, CO "
48,Accenture,Associate Software Engineer (Current Employee) ,Productive and fun,"<button aria-describedby=""cmp-rating-tooltip-1fe2ukvk2pi24802"" aria-label=""5.0 out of 5 stars."" class=""css-1c33izo e1wnkr790"">5.0</button>","Fun, good professional development, offers a lot of trainings, Lots of overtime because of working from home. The management offers a lot of benefits to its employees."," August 26, 2021"," New York, NY "
49,Accenture,Adjudication Specialist (Former Employee) ,Great culture!,"<button aria-describedby=""cmp-rating-tooltip-1g10o5hvbt4e6800"" aria-label=""5.0 out of 5 stars."" class=""css-1c33izo e1wnkr790"">5.0</button>",Great company and culture. Compensation could be higher. Access to training needs to be updated so th as to all employees would be able to take courses.," April 19, 2022", Remote 
50,Accenture,Software Engineer (Former Employee) ,Overall good company,"<button aria-describedby=""cmp-rating-tooltip-1g022si22sa70802"" aria-label=""5.0 out of 5 stars."" class=""css-1c33izo e1wnkr790"">5.0</button>","As I have started with Accenture, it offered me lot of things to learn and grow. I will surely recommend to my friends and colleagues. Best consulting place to work"," April 7, 2022"," Georgetown, TX "
