,company,Designation,title,rating,review,date,Place
1001,Guardian Pharmacy,Pharmacy Technician (Former Employee) ,Favoritism ,"<button aria-describedby=""cmp-rating-tooltip-1g0ai6ns8l1gr802"" aria-label=""1.0 out of 5 stars."" class=""css-1c33izo e1wnkr790"">1.0</button>","During my time working with this company, I've experienced being a victim of mistreatment by management. It doesn't matter if you are the hardest worker there. You are expected to make a choice on putting the company first. A company based on a point system will always result in losing the best employees they need to help the company to further grow."," April 10, 2022"," Orlando, FL "
1002,Guardian Pharmacy,Certified Pharmacy Technician/ Cycle Coordinator (Former Employee) ,Productive,"<button aria-describedby=""cmp-rating-tooltip-1g05tki1mi6j1801"" aria-label=""2.0 out of 5 stars."" class=""css-1c33izo e1wnkr790"">2.0</button>","Low pay, management could be better. The pay is not good at all and raises are minimal. I had an issue having to do someone else’s work because they wouldn’t complete it. Management neglected the incident and I left.                                                          "," April 8, 2022"," Wytheville, VA "
1003,Guardian Pharmacy,Collections Specialist (Current Employee) ,Good place to work.,"<button aria-describedby=""cmp-rating-tooltip-1fva2m4emsa63800"" aria-label=""5.0 out of 5 stars."" class=""css-1c33izo e1wnkr790"">5.0</button>","Decent pay, normal hours. Work-life balance is great. Managers are understanding and will work with you. Overall enjoy working here and hope to do so for a long time."," March 29, 2022"," Pink Hill, NC "
1004,Guardian Pharmacy,Certified Pharmacy Technician (CPhT) (Current Employee) ,Teamwork ,"<button aria-describedby=""cmp-rating-tooltip-1fuvm92lhu2a6800"" aria-label=""2.0 out of 5 stars."" class=""css-1c33izo e1wnkr790"">2.0</button>","If you work hard and sufficiently, your teammates notice and respect it. Afterwards, they respect you and are willing to help as needed. My teammates make me feel that I am a respected team player, because of the my loyalty, although I that have multiple jobs. But if our hard work was given credit, we would have less employee turnover."," March 24, 2022"," Pink Hill, NC "
1005,Guardian Pharmacy,Pharmacy Technician (Current Employee) ,Employee,"<button aria-describedby=""cmp-rating-tooltip-1fu1vpfphm6cq802"" aria-label=""5.0 out of 5 stars."" class=""css-1c33izo e1wnkr790"">5.0</button>",They really care about their employees well being. They definitely understand that life gives you problems and they are there to help you solve them. ," March 13, 2022"," Jacksonville, FL "
1006,Guardian Pharmacy,Delivery Driver (Former Employee) ,Excellent Owner!  ,"<button aria-describedby=""cmp-rating-tooltip-1fsg0l05ru20h800"" aria-label=""3.0 out of 5 stars."" class=""css-1c33izo e1wnkr790"">3.0</button>","Do not think outside of the box, forget ideas or suggestions. Go to work, go home and be happy. Everything else is a waste of your time and energy. Great benefits but in this time of everyone hiring, the pay looks better elsewhere."," February 22, 2022"," Brunswick, ME "
1007,Guardian Pharmacy,Pharmacist (Current Employee) ,ABSOLUTELY the BEST place I have ever worked at! My plan is to retire from here!,"<button aria-describedby=""cmp-rating-tooltip-1fri2bsk9sa2l802"" aria-label=""5.0 out of 5 stars."" class=""css-1c33izo e1wnkr790"">5.0</button>","I came from a three-letter chain pharmacy. That was the worst experience I ever had in a pharmacy. Some of the darkest days of my life. When I found out about Guardian my life completely turned around. Since I came here everyone in my life can tell a huge difference. After the first week, my wife said that I was night and day different. I was finally able to understand what enjoying your job felt like. I actually feel respected with the amount of staffing we have on any given day! I am a huge The Office fan, this feels like the pharmacy version of The Office. This is the most fun work environment I've ever been in, it has been life-changing! I never want to leave this place!"," February 10, 2022"," Knoxville, TN "
1008,Guardian Pharmacy,Data Entry Specialist (Former Employee) ,Beware!,"<button aria-describedby=""cmp-rating-tooltip-1fqubbfnpu2gm802"" aria-label=""1.0 out of 5 stars."" class=""css-1c33izo e1wnkr790"">1.0</button>","Horrible company to work for. Favoritism is heavily shown to certain people and management does not communicate effectively and efficiently. If you have children, they do not work with you"," February 2, 2022"," Bartlett, TN "
1009,Guardian Pharmacy,Medical Delivery Driver (Former Employee) ,You gota work weather your sick or not ,"<button aria-describedby=""cmp-rating-tooltip-1fonoatn1sa9a800"" aria-label=""1.0 out of 5 stars."" class=""css-1c33izo e1wnkr790"">1.0</button>",No insurance no vacation time no sick days you must work your scheduled days no one will ever fill in for you or the boss won’t find anyone they take there totes home with them if anything would happen your the one who gets in trouble they push the buck to you don’t ever call your boss he gets mad figure it out yourself this job is so bad don’t apply you will end up so miserable. If you do good luck ," January 6, 2022", Ohio 
1010,Guardian Pharmacy,Billing Specialist (Former Employee) ,Wouldn’t recommend. ,"<button aria-describedby=""cmp-rating-tooltip-1focma2m9t63j802"" aria-label=""1.0 out of 5 stars."" class=""css-1c33izo e1wnkr790"">1.0</button>",High turnover rate. Please consider another company with longevity. Very repetitious and easy job task but not a place to develop your skill set and grow within the company. Please consider another company before this one. ," January 2, 2022"," Jacksonville, FL "
1011,Guardian Pharmacy,Data Entry Pharmacy Technician (Former Employee) ,Do not work here. Ever.,"<button aria-describedby=""cmp-rating-tooltip-1fng1oh88t63j800"" aria-label=""1.0 out of 5 stars."" class=""css-1c33izo e1wnkr790"">1.0</button>","Was ""let go"" 5 days before Christmas with NO explanation... Assuming it was because I was considering other job opportunities due to unfair wages and completely bias situations that did not make me feel secure or supported in my job. The environment is AWFUL, it is full of drama, and management is very very two-faced. 100% would not ever recommend."," December 21, 2021"," Eufaula, OK "
1012,Guardian Pharmacy,Medical Billing Specialist (Former Employee) ,Management harass there employees.  Stressful environment.,"<button aria-describedby=""cmp-rating-tooltip-1filnlrqcnph6800"" aria-label=""1.0 out of 5 stars."" class=""css-1c33izo e1wnkr790"">1.0</button>",Needs to be more respectful and kind to there employees.  More family oriented. More time off for vacations.  More holidays.  More sick time. Less stressful environment.," October 22, 2021"," San Diego, CA "
1013,Guardian Pharmacy,Billing Specialist (Former Employee) ,Miserable mess!,"<button aria-describedby=""cmp-rating-tooltip-1fiivhjvgu423800"" aria-label=""1.0 out of 5 stars."" class=""css-1c33izo e1wnkr790"">1.0</button>",Miserable place to work. People talk about each other like they did in Kindergarten and elementary school..No one is trusted to do their jobs..Slave labor for pennies..Run far awy if you have low self Esteem because you will have to have nerves of steel to survive in this place..Management sucks and plays favorites.," October 21, 2021"," Kernersville, NC "
1014,Guardian Pharmacy,Pharmacist (Current Employee) ,Family,"<button aria-describedby=""cmp-rating-tooltip-1fif1iaj5u3np801"" aria-label=""5.0 out of 5 stars."" class=""css-1c33izo e1wnkr790"">5.0</button>",Great schedules for techs and pharmacists. Pay is competitive. The whole pharmacy is supportive and feels like a family. Holidays are minimal. Great place to work and stay for a long time. ," October 20, 2021"," Knoxville, TN "
1015,Guardian Pharmacy,Courier (Former Employee) ,Worst place ever to work,"<button aria-describedby=""cmp-rating-tooltip-1fhs1n87gs7e5800"" aria-label=""1.0 out of 5 stars."" class=""css-1c33izo e1wnkr790"">1.0</button>",Run don’t work here!! If you do it would be a waste of your life. Management sucks and cares nothing for their employees. Let’s the good people that actually want to succeed leave because of letting the bad employees getting away with anything. Long hours and get nothing in return. Corporate really needs to come in to see what is going on but they don’t seem to care either. All about the $$," October 13, 2021"," Kernersville, NC "
1016,Guardian Pharmacy,Billing Specialist (Former Employee) ,"Good and bad, as in all things!","<button aria-describedby=""cmp-rating-tooltip-1fgmo2mgi309p002"" aria-label=""3.0 out of 5 stars."" class=""css-1c33izo e1wnkr790"">3.0</button>","It is a mostly casual and comfortable work environment. Under staffed and lack of communication between departments seem to be an ongoing issue. Managers are approachable, but they are often dealing with compounding workloads.  There are attempts to correct ongoing problems, but old habits tend to persevere. Negative and often griping (for all to hear) employees do not seem to be coached, redirected or disciplined."," September 28, 2021"," San Diego, CA "
1017,Adventist Health,Patient Access Representative (Former Employee) ,Some of the people,"<button aria-describedby=""cmp-rating-tooltip-1g15ldgku2v78001"" aria-label=""3.0 out of 5 stars."" class=""css-1c33izo e1wnkr790"">3.0</button>","Management does not necessarily look after their staff or protect them against patients. The team I worked with was awesome, but they need more mix of ethnicity in the workplace."," April 21, 2022"," Kailua, HI "
1018,Adventist Health,SCR float pool L&D RN (Current Employee) ,Great place to work! Everyone is smiling and laughing. ,"<button aria-describedby=""cmp-rating-tooltip-1g175o748nq3m802"" aria-label=""5.0 out of 5 stars."" class=""css-1c33izo e1wnkr790"">5.0</button>","I love this job. There is no better place to work in my opinion. Like I said, my L&D manager actually comes out to help when we are busy...she will put on a pair of scrubs, roll up her sleeve, and dive in. She buys us food when we are busy and don't get a break which is very rare because they are very good at making sure nurses get their breaks."," April 21, 2022"," Glendale, CA "
1019,Adventist Health,Analyst (Current Employee) ,Unfortunately Poor Experience,"<button aria-describedby=""cmp-rating-tooltip-1g0vkn3j3m6hr801"" aria-label=""2.0 out of 5 stars."" class=""css-1c33izo e1wnkr790"">2.0</button>","Company is poorly mis-managed. There is little opportunity for growth and they are quick to lay people off as a quick solution to budget issues. They preach the mission of the company, but upper leadership doesn't practice it. Upper leadership is poor at communicating and they let rumors fly around. It's sad because many of the people that work there are there for the mission and truly believe in the mission. "," April 18, 2022"," Roseville, CA "
1020,Adventist Health,Occupational Therapist (Current Employee) ,Overworked staff and lots of turn over,"<button aria-describedby=""cmp-rating-tooltip-1g06ajndcl1gr800"" aria-label=""2.0 out of 5 stars."" class=""css-1c33izo e1wnkr790"">2.0</button>",Staff here is overworked and underpaid. Turnover is increasing. Nursing staff is always low census and pushes their pt showers and toileting onto the therapists. Avoid if possible!," April 8, 2022"," Lodi, CA "
1021,Adventist Health,Staff Nurse (Current Employee) ,Good place to work ,"<button aria-describedby=""cmp-rating-tooltip-1g051vb91k24g800"" aria-label=""3.0 out of 5 stars."" class=""css-1c33izo e1wnkr790"">3.0</button>","Always wanted to work for Adventhealth and finally got the chance. It’s a good company to work for and I love the company’s mission and what they stand for. Haven’t been here that long, we will see how this goes. "," April 8, 2022"," Davenport, FL "
1022,Adventist Health,Registered Nurse (RN) (Current Employee) ,The Culture ,"<button aria-describedby=""cmp-rating-tooltip-1fvunouah308k001"" aria-label=""3.0 out of 5 stars."" class=""css-1c33izo e1wnkr790"">3.0</button>","The culture at adventist health and rideout is amazing. You always have help and everyone is willing to help. The people at work is what makes the place worth it. Otherwise, the administration is trash and the hospital overall is not good. But again, the people are amazing."," April 6, 2022"," Marysville, CA "
1023,Adventist Health,Purchasing Assistant (Former Employee) ,My coworker are very  passionate about their jobs as well their family!,"<button aria-describedby=""cmp-rating-tooltip-1fvtig49m3kf6001"" aria-label=""5.0 out of 5 stars."" class=""css-1c33izo e1wnkr790"">5.0</button>","Started as a Evs worker, promoted to purchasing department. Then another promotion to purchasing buyer, and then moved to another position in surgery as buyer. In spare time learn to process surgical instruments. Very good experience as a employee of Adventist health Clearlake ca . Still have many friends there "," April 5, 2022"," Clearlake, CA "
1024,Adventist Health,Lead Associate Operations (Current Employee) ,Flexible days off,"<button aria-describedby=""cmp-rating-tooltip-1fvr0geeao23p801"" aria-label=""4.0 out of 5 stars."" class=""css-1c33izo e1wnkr790"">4.0</button>",Very flexible when it comes to time off for family situations.  Free to make necessary decisions. Great values and mission. Faith based organization.," April 4, 2022"," Hanford, CA "
1025,Adventist Health,Former employee  (Former Employee) ,Not a great experience ,"<button aria-describedby=""cmp-rating-tooltip-1fuejkvp3pi1g800"" aria-label=""2.0 out of 5 stars."" class=""css-1c33izo e1wnkr790"">2.0</button>","I worked for Adventist for approximately 3 months and was not impressed. Although some of my colleagues were friendly/welcoming, I did not like the work culture at all. As soon as I started, an upper leadership staff resigned without notice and did something to our work lists. I received an email from the HR director stating I had a pay increase and provided me the same base rate I was already making and in the letter it stated not to share the “new” rate with other staff since they may not have qualified for the raise; I emailed the HR director and he said it was sent in error.  Some how work overlaps with other staff members, and their systems are always having some sort of IT issue. Being a large organization, I was expecting that they would not have such IT issues pretty much on a daily basis.  I had high hopes with Adventist and this being a place I could work all the way til I retired, but sadly it was not. "," March 18, 2022", Adventist Roseville  
1026,Adventist Health,Department Secretary & Customer Service Representative (Former Employee) ,I enjoyed my employment at Adventist ,"<button aria-describedby=""cmp-rating-tooltip-1fuditbp5m6hd800"" aria-label=""5.0 out of 5 stars."" class=""css-1c33izo e1wnkr790"">5.0</button>",I felt being part of an outsourcing was unfair. No assistance from HR staff to try to resolve things not even the benefit staff. No return call and these were people I dealt with often.," March 17, 2022"," Hanford, CA "
1027,Adventist Health,Family Nurse Practitioner (Current Employee) ,Productive work place ,"<button aria-describedby=""cmp-rating-tooltip-1fuconk8bt5js801"" aria-label=""4.0 out of 5 stars."" class=""css-1c33izo e1wnkr790"">4.0</button>",Nice place to work for. Management is very accommodating to your needs. Patient care is top priority but complain takes care of their employees. Thanks ," March 17, 2022"," Reedley, CA "
1028,Adventist Health,Assistant  (Current Employee) ,Good company ,"<button aria-describedby=""cmp-rating-tooltip-1fub0gq3jms9p800"" aria-label=""3.0 out of 5 stars."" class=""css-1c33izo e1wnkr790"">3.0</button>",This company supports work life balance and is flexible for parents. Advancement is difficult if you don’t have a masters degree. They prioritize schooling over experience and knowledge. Pay is okay especially if you’re clinical. They have a good mission and they treat the employees well ," March 16, 2022", California 
1029,Adventist Health,Office Manager (Current Employee) ,Best Place to Work,"<button aria-describedby=""cmp-rating-tooltip-1fu4s4jv7o21l800"" aria-label=""5.0 out of 5 stars."" class=""css-1c33izo e1wnkr790"">5.0</button>",Adventist Health Sonora treats their associates with love and grace. They have been wonderful to work for and I am proud to be part of the Adventist  Health team. ," March 14, 2022"," Sonora, CA "
1030,Adventist Health,Certified Medical Assistant (Current Employee) ,"Lack of appreciation, compensation, and resources.","<button aria-describedby=""cmp-rating-tooltip-1ftqtulnbm6j7802"" aria-label=""3.0 out of 5 stars."" class=""css-1c33izo e1wnkr790"">3.0</button>","This company needs a lot of work especially within their Clinic Administration. Employee's that LOVED their job, have resorted to leaving this organization because administration does not listen to the concerns regarding provider behavior, lack of patient care, and requests for changes go on the back burner. They will turn their back on you if you speak up, and blame you for being the issue. They don't compete financially with a lot of other organizations, leaving people to find better paying positions due to the increase in cost of living, and goods."," March 10, 2022"," Portland, OR "
1031,Adventist Health,Lab Assistant/Phlebotomist (Current Employee) ,The laboratory management needs to be replaced with people who actually know what they're doing.  Have had experience from ground up!,"<button aria-describedby=""cmp-rating-tooltip-1ftm1t36jo1jn800"" aria-label=""2.0 out of 5 stars."" class=""css-1c33izo e1wnkr790"">2.0</button>","I love my work,  but Adventist Health does not care about their employees or really even their patients.  It's really sad how they only care about what looks good on paper.  "," March 8, 2022"," Marysville, CA "
1032,Adventist Health,Unit Associate (Former Employee) ,"It’s just an ok place, it can be fun, or it could be miserable","<button aria-describedby=""cmp-rating-tooltip-1ftlvpanmo1je802"" aria-label=""4.0 out of 5 stars."" class=""css-1c33izo e1wnkr790"">4.0</button>",It’s just an alright place. It’s functional and depending on your coworkers it could be fun or it could be miserable. Management isn’t really professional and upper management does a poor job or showing appreciation.  I don’t think there’s a lot of trustworthiness. It is a diverse place for patient interaction though. ," March 8, 2022"," Bakersfield, CA "
1033,Adventist Health,Healthcare Representative (Former Employee) ,Productive and fun workplace,"<button aria-describedby=""cmp-rating-tooltip-1ftjmef28o1j3802"" aria-label=""3.0 out of 5 stars."" class=""css-1c33izo e1wnkr790"">3.0</button>","When I first started working there in 2005, it was a good workplace. The employees and physicians everybody worked together was a team environment. Once the management changed several years later it felt more competitive because it started dividing up between departments. But I did enjoy my job and I was sad when I have to come turn in because of the disability that I had at the time in 2014 which is a manager at the time was unable to accommodate me. But I feel it was more of a personal issue that she wanted me gone. I got along with everybody and everybody came to me with questions and help and that was one thing she didn’t care for. So I just feel she found a way to push me out."," March 7, 2022"," Selma campus, Selma California "
1034,Adventist Health,Unit Coordinator (Current Employee) ,The people I work with are absolutely amazing ,"<button aria-describedby=""cmp-rating-tooltip-1fteesdhlo1el801"" aria-label=""4.0 out of 5 stars."" class=""css-1c33izo e1wnkr790"">4.0</button>",Adventist is a good place to work. However the compensation is not competitive with other companies in the area. I love my co worker's.  The only reason I would leave is the pay," March 5, 2022"," Portland, OR "
1035,Adventist Health,Patient Access Representative (Former Employee) ,Decent i guess,"<button aria-describedby=""cmp-rating-tooltip-1ft8g1vioo21i802"" aria-label=""2.0 out of 5 stars."" class=""css-1c33izo e1wnkr790"">2.0</button>","used to be an awesome place to work...money and greed took over, and slowly but surely things began to change. Firing several employees and expecting the rest to pick up slack...(several employee's either fired or lay-offed)"," March 3, 2022"," Central Valley, CA "
1036,Ridley's Family Markets,Floral Manager (Former Employee) ,Overworked and Underpaid,"<button aria-describedby=""cmp-rating-tooltip-1fu7d152pu2uv800"" aria-label=""3.0 out of 5 stars."" class=""css-1c33izo e1wnkr790"">3.0</button>","They don’t allow enough people to be hired/hours to be given in the floral department, so I was overworked and underpaid. The manager at the store I was in was a great manager, but I felt corporate expected too much."," March 15, 2022"," Eagle Mountain, UT "
1037,Ridley's Family Markets,Bagger/Stocker (Former Employee) ,Management sucks no people are rude ,"<button aria-describedby=""cmp-rating-tooltip-1fv1p14ch308p000"" aria-label=""1.0 out of 5 stars."" class=""css-1c33izo e1wnkr790"">1.0</button>",They suck managment sucks and I always got docked points even though I was in time and worked the right shift the people suck as well don’t work there you will regret it instantly I hated it so much the managers were very rude as well," March 25, 2022"," Hyrum, UT "
1038,Ridley's Family Markets,Any position (Former Employee) ,If zero was an option,"<button aria-describedby=""cmp-rating-tooltip-1ful70feom6hd800"" aria-label=""1.0 out of 5 stars."" class=""css-1c33izo e1wnkr790"">1.0</button>","This company treats their employees like garbage. Works them days on end, no days off, lies, and refusing to offer help and better labor opportunities, all so they can penny pinch a dollar. Most department heads (if not all) are treated like absolute trash, they do not give two figs about your well-being or compensate you for what you deserve. Under appreciated and treated worse than any other company I’ve came in contact with. And this is coming from someone who does not even work there, is solely seeing how they treat my friends, and significant other."," March 20, 2022"," Star, ID "
1039,Ridley's Family Markets,Cashier (Current Employee) ,Waste of Time,"<button aria-describedby=""cmp-rating-tooltip-1ftcgos9omsar800"" aria-label=""1.0 out of 5 stars."" class=""css-1c33izo e1wnkr790"">1.0</button>",The company does not replace equipment whatsoever and the Buhl location is lead by a ignorant store manager that does not give raises whatsoever even if you move up in the store even if you've been with them for a while. Disgusted by the lack of respect. ," March 5, 2022"," Buhl, ID "
1040,Ridley's Family Markets,Cashier (Former Employee) ,Workers are friendly but you do more than what you get paid for ,"<button aria-describedby=""cmp-rating-tooltip-1ft9chp1lmsar801"" aria-label=""4.0 out of 5 stars."" class=""css-1c33izo e1wnkr790"">4.0</button>",Workers are friendly but you do more than you are paid for and the pay isn’t good. But a good stepping stone if you are looking to get into other grocery stores," March 3, 2022"," Star, ID "
1041,Ridley's Family Markets,Pharmacist (Former Employee) ,Better to seek employment elsewhere,"<button aria-describedby=""cmp-rating-tooltip-1fs500u2fjp30802"" aria-label=""1.0 out of 5 stars."" class=""css-1c33izo e1wnkr790"">1.0</button>","Steer clear here, only poor management that doesn't even follow their own policies and procedures. Really they should sell-out the Pharmacy business to another company as it is not something they appear to know how to properly operate. Poor compensation and under-staffing, along with outdated computers make this a difficult  working environment. Offers No paid holidays, must use your own PTO to offset the loss in hours on holiday closures.The 2 best days of working here was the day I was hired, and the day I left."," February 17, 2022", Idaho 
1042,Ridley's Family Markets,Cashier (Former Employee) ,Never work here,"<button aria-describedby=""cmp-rating-tooltip-1frlmqheq308t000"" aria-label=""1.0 out of 5 stars."" class=""css-1c33izo e1wnkr790"">1.0</button>",Awful place to work. Only come here if you’d like to be treated like garbage. The management is horrible. The owners are cheap skates. Worst employer ever. You’d be paid more in fast food.," February 11, 2022"," Buhl, ID "
1043,Ridley's Family Markets,Cashier (Current Employee) ,"Simple and not stressful work, but repetive and poor pay","<button aria-describedby=""cmp-rating-tooltip-1frgl3esanq3q801"" aria-label=""2.0 out of 5 stars."" class=""css-1c33izo e1wnkr790"">2.0</button>","I know that Cashiers don't earn much, but much of our time is wasted standing at our register with nothing to do. There is much wasted labor, and the pay is poor"," February 9, 2022"," Tremonton, UT "
1044,Ridley's Family Markets,Coffee Barista (Former Employee) ,"Overworked, understaffed, not paid fairly. ","<button aria-describedby=""cmp-rating-tooltip-1fp2nhinnu2ig800"" aria-label=""1.0 out of 5 stars."" class=""css-1c33izo e1wnkr790"">1.0</button>","Management was incompetent. They never cared about or physical or mental health. No employee benefits. Never received our tips working at the coffee shop, held them for 6 months from us. Did not feel supported at all. "," January 10, 2022"," Star, ID "
