,company,Designation,title,rating,review,date,Place
642,Tonal,Sales Specialist (Former Employee) ,Not for me,"<button aria-describedby=""cmp-rating-tooltip-1fl4u6qbtn59v800"" aria-label=""3.0 out of 5 stars."" class=""css-1c33izo e1wnkr790"">3.0</button>",Temporary. The district manager was not understanding and all they want is for you to sell the Tonal. Force you to get people emails. Clients were annoyed by all the emailing and calls.," November 22, 2021"," Aventura, FL "
643,Tonal,Consultant (Former Employee) ,Nda,"<button aria-describedby=""cmp-rating-tooltip-1dteuhvq9q59n803"" aria-label=""3.0 out of 5 stars."" class=""css-1c33izo e1wnkr790"">3.0</button>",I enjoy the team I work with and most of the management staff make themselves available when you need them. They encourage you to use the chain of command and someone always gets back to you in a timely manner. The individuals are a pleasure to be around. The job is not always easy however it can be very rewarding. You have to be willing to put the work in and be a team player.," December 31, 2019"," San Francisco, CA "
644,Tonal,INTERNSHIP (Former Employee) ,Productive Workplace,"<button aria-describedby=""cmp-rating-tooltip-1cuvcm07n1bg6000"" aria-label=""5.0 out of 5 stars."" class=""css-1c33izo e1wnkr790"">5.0</button>","Very friendly staff and management, great workplace. I got a first hand look how  a small business operates and how product packaging is a great first impression."," December 17, 2018"," Los Angeles, CA "
645,National Research Group,Market Research Analyst (Former Employee) ,"mundane tasks, lack of management, and cliquey culture","<button aria-describedby=""cmp-rating-tooltip-1fvvqhj3cptsq800"" aria-label=""2.0 out of 5 stars."" class=""css-1c33izo e1wnkr790"">2.0</button>","clients are great here, but tasks are extremely boring unless you want to prepare PowerPoints and check surveys all day. there is no management structure and they just expect you to do all of the work."," April 6, 2022", Remote 
646,National Research Group,Director (Current Employee) ,Look somewhere else,"<button aria-describedby=""cmp-rating-tooltip-1faepj632u2hu800"" aria-label=""1.0 out of 5 stars."" class=""css-1c33izo e1wnkr790"">1.0</button>","You are expected to be available all the time (all hours of the day, weekends, holidays, etc.).  No work life balance what so ever.  Not enough people to do the work coming in."," July 12, 2021", California 
647,National Research Group,Market Research Screener (Current Employee) ,Screener Position,"<button aria-describedby=""cmp-rating-tooltip-1dl7theqpb84i801"" aria-label=""3.0 out of 5 stars."" class=""css-1c33izo e1wnkr790"">3.0</button>",You are required to work 4 times a month. The amount of typical screenings available per month range from 8 - 10. The job itself is not very demanding.," September 20, 2019"," Hollywood, CA "
648,National Research Group,FINANCIAL CONSULTANT (Former Employee) ,Good Company but no management or training,"<button aria-describedby=""cmp-rating-tooltip-1cigav5v5b88vc46"" aria-label=""2.0 out of 5 stars."" class=""css-1c33izo e1wnkr790"">2.0</button>",The company is poorly managed.  Most managers worked from home.  Employees were not very happy as they had no training or guidance.  I would not really recommend long term employment here as the owners seem to hire their college friends and a large amount of consultants and contract work.  No job security at all.," July 15, 2018"," Los Angeles, CA "
649,National Research Group,"Research Manager, Operations (Former Employee) ",Experienced company going through changes,"<button aria-describedby=""cmp-rating-tooltip-1cdniadd4b84serh"" aria-label=""3.0 out of 5 stars."" class=""css-1c33izo e1wnkr790"">3.0</button>","I spent over 17 years working at NRG, and it was a great experience for the most part.  I was able to advance from an entry level position to a department manager position then to a research manager position.  I met a lot of great people along the way, and the long hours and high volume bonded people together.  I enjoyed working there, but in the last several years with new ownership, there has been a lot of turnover and a rearrangement of the company that has resulted in long term employees losing their positions, including myself.  However, despite my mixed feelings about new ownership and management, I would recommend NRG for someone who is trying to get their foot in the door, on the business side of the movie industry, and it could provide an interesting look into what makes the movie industry tick."," May 17, 2018"," 5780 W Jefferson Blvd Los Angeles, CA 90016 "
650,Thrive Market,Senior Growth Manager (Former Employee) ,Thrive Market Rocks,"<button aria-describedby=""cmp-rating-tooltip-1dn0i6fp5b828802"" aria-label=""5.0 out of 5 stars."" class=""css-1c33izo e1wnkr790"">5.0</button>",Thrive is one of the best organizations I've ever worked for.  I left them too soon and would love to work with them again in the future. They are top line and really care about the cause and their employees.," October 12, 2019"," Los Angeles, CA "
651,Thrive Market,Picker (Former Employee) ,Not a good job. ,"<button aria-describedby=""cmp-rating-tooltip-1g0kvd2osgsqf800"" aria-label=""1.0 out of 5 stars."" class=""css-1c33izo e1wnkr790"">1.0</button>","If you can work like a robot, this may be the job for you. The weekend managers for dayshift are pathetic, most of them are childish. They will fire you with no warnings if you don’t hit their “rate” but keep other full time employees who don’t hit rate. It’s like they pick and choose. "," April 14, 2022"," Batesville, IN "
652,Thrive Market,Sales Associate (Former Employee) ,The worst place to work ,"<button aria-describedby=""cmp-rating-tooltip-1g0fsvdd2gsqf800"" aria-label=""1.0 out of 5 stars."" class=""css-1c33izo e1wnkr790"">1.0</button>","Managers don’t care about you, they only care about the numbers you make. In the orientation they will tell you this is the best place to work, but it is the opposite. It doesn’t matter how much you learn about the job and get trained in other areas you won’t grow in this company. "," April 12, 2022"," Hanover, PA "
653,Thrive Market,Picker/Packer (Current Employee) ,Not bad ,"<button aria-describedby=""cmp-rating-tooltip-1g0cdih69gsqf802"" aria-label=""4.0 out of 5 stars."" class=""css-1c33izo e1wnkr790"">4.0</button>",Not bad job it is simple work good environment good management (this is only for 1st shift idk about any other shifts) I’d say the only problem is walking too much but it’s a warehouse they’re all physical ," April 11, 2022"," Hanover, PA "
654,Thrive Market,Picker/Packer/Trainer (Former Employee) ,Terrible ,"<button aria-describedby=""cmp-rating-tooltip-1fu1kp4uvu2ju802"" aria-label=""1.0 out of 5 stars."" class=""css-1c33izo e1wnkr790"">1.0</button>",terrible workplace does not have good supervision it is dangerous since it does not have a good safety guide there are people who come from outside with heels manager my hypocritical double face really does not care about his employees and lacks respect for the elderly and people with disabilities they do not know not even salaries say one price and pay another and excuse themselves that without a new company," March 13, 2022"," Hanover Twp, PA "
655,Thrive Market,Picker/Packer (Former Employee) ,Fast pace job,"<button aria-describedby=""cmp-rating-tooltip-1frv4r1dp2qng000"" aria-label=""3.0 out of 5 stars."" class=""css-1c33izo e1wnkr790"">3.0</button>","Lots of different shifts was a plus being a working mom that could only do weekends And still get 40 hours in each week, long hours running circles for 12 hours is hard on your feet so comfortable shoes is a must"," February 15, 2022"," Batesville, IN "
656,Thrive Market,Picker/Packer (Current Employee) ,Not a bad place to work,"<button aria-describedby=""cmp-rating-tooltip-1fr332lmou1vl802"" aria-label=""3.0 out of 5 stars."" class=""css-1c33izo e1wnkr790"">3.0</button>",Management is supportive and always answers questions. They offer as much overtime as you would like to work which is a big plus. Working 6 days out of the week I do not feel overworked and can make a lot of money. Team leads offer encouragement when you are doing a good job which only gives more of a desire to do well," February 4, 2022"," Batesville, IN "
657,Thrive Market,Outbound Associate (Former Employee) ,"Up and Down Environment, Good at times, Exhausting at times ","<button aria-describedby=""cmp-rating-tooltip-1fqq02hiknpqo800"" aria-label=""2.0 out of 5 stars."" class=""css-1c33izo e1wnkr790"">2.0</button>","somedays good, somedays exhausting, somedays are fun, overall just felt over worked at times, not my ideal job no more and constant change within leadership and management"," February 1, 2022"," Sparks, NV "
658,Thrive Market,Warehouse Worker (Current Employee) ,Disappointed,"<button aria-describedby=""cmp-rating-tooltip-1fpji7h2lu34s802"" aria-label=""1.0 out of 5 stars."" class=""css-1c33izo e1wnkr790"">1.0</button>",They don't care about their employees only hitting numbers.  Long hours due to mandatory overtimeRules only apply for some peopleMinimum covid safe guards," January 17, 2022"," Hanover, PA "
659,Thrive Market,Thriver (Current Employee) ,Easy but...,"<button aria-describedby=""cmp-rating-tooltip-1fp5o8oac3gt7000"" aria-label=""3.0 out of 5 stars."" class=""css-1c33izo e1wnkr790"">3.0</button>","Easy work, loved it for the first two months until they mandated us for 44 hours overtime plus an extra hour to our daily shift and pointed those who were unable to do the mandated overtime even if they made it known in advance, called a meeting to tell us we couldn't go to the bathroom after our breaks, only during, refused to work with multiple employees who were sick AND docked all of night shifts pay by nearly 3 dollars. People are afraid to go to the bathroom or to call off sick in fear of being pointed or written up. Supervisors try their best to accommodate but theres only so much they can do. Morale is low and everyone is miserable."," January 11, 2022"," Hanover, PA "
660,Thrive Market,Warehouse Associate (Former Employee) ,They mess with your pay and fire sick people.,"<button aria-describedby=""cmp-rating-tooltip-1fo1bn6cvu4pp801"" aria-label=""1.0 out of 5 stars."" class=""css-1c33izo e1wnkr790"">1.0</button>","They will fill your head with ""we're not like other warehouses"" only to fire you for getting sick before your 90 days. They mess with your pay and when asked about it they can't provide a solid answer as to what it will be and when it will change. Their points system allows for 5 during your 90 day period. If you call off through the phone line that's 2, so 2 days you're allowed to get sick or 1 no call no show for emergencies within 3 months. Once you go even half a point over the 5, like I did, you're done. It doesn't matter how your record looked before or the fact you came in every day for 76/90 days and happen to get sick two weeks prior to being ""allowed"" to. You're fired, end of story."," December 28, 2021"," Township of Hanover, PA "
661,Thrive Market,Picker/Packer (Current Employee) ,The pay,"<button aria-describedby=""cmp-rating-tooltip-1fl1i3llen5co802"" aria-label=""1.0 out of 5 stars."" class=""css-1c33izo e1wnkr790"">1.0</button>",The good the pay the benefits have gotten better and the hours aren't bad but you'll earn every bit of your pay.The bad everything else be prepared for slave labor and if you do good they'll throw you a pizza party.," November 21, 2021"," Batesville, IN "
662,Thrive Market,Packer (Former Employee) ,You have no life or energy working for this company,"<button aria-describedby=""cmp-rating-tooltip-1fkhcdtbi304j000"" aria-label=""1.0 out of 5 stars."" class=""css-1c33izo e1wnkr790"">1.0</button>",This job doesn't care about your well being they ask alot of your time by the time your shift is over you are too tired to enjoy anything outside of work. They have alot of favoritism. It's not a good place to work," November 15, 2021"," Sparks, NV "
663,Thrive Market,Distribution Center Associate (Former Employee) ,Not a bad place to work,"<button aria-describedby=""cmp-rating-tooltip-1fg6l3cf7hie4801"" aria-label=""4.0 out of 5 stars."" class=""css-1c33izo e1wnkr790"">4.0</button>",I'd say they definitely need to take a look at certain upper management that they hire team leaders mainly you have good and bad if they were to pay you every week when you go full time the job would be a four out of five overall with getting paid every two weeks and certain management team leaders issues brings it down to a three out of five all in all you have a couple great team leaders and management and then you have your bad eggs which pretty much ruined everything," September 22, 2021"," Batesville, IN "
664,Thrive Market,Picker/Packer (Former Employee) ,It's a job,"<button aria-describedby=""cmp-rating-tooltip-1fer7sjiv308t000"" aria-label=""3.0 out of 5 stars."" class=""css-1c33izo e1wnkr790"">3.0</button>",Zero advancement opportunity unless youre buddy buddy with management no matter what your previous experience or education is. Once you're in a production position you're locked at that level.," September 5, 2021"," McCarran, NV "
665,Thrive Market,Warehouse Associate (Former Employee) ,Stay away,"<button aria-describedby=""cmp-rating-tooltip-1faor2vqlu1ea800"" aria-label=""2.0 out of 5 stars."" class=""css-1c33izo e1wnkr790"">2.0</button>",The only positive reviews you will see is from people who never leave the office. They talk the place up during orientation like it's heaven. What happens in the office and in the warehouse are two different places. Mandatory overtime whether you like it or not. Management makes mistakes and passes down to the workers. It's not hard work but it will ruin your body and morale. Pay and benefits are good but you cant enjoy them if your are working 6 days a week. ," July 16, 2021"," Hanover Township, PA "
666,Thrive Market,Picker/Packer/Forklift Operator (Former Employee) ,Great pay and benefits ,"<button aria-describedby=""cmp-rating-tooltip-1fahc6bbgu2sn802"" aria-label=""4.0 out of 5 stars."" class=""css-1c33izo e1wnkr790"">4.0</button>",       I worked there almost a year and it was a great experience pay is great employees are great and the benefits are really good a lot of exercise walking and standing ," July 13, 2021"," Batesville, IN "
667,Thrive Market,Specialist (Current Employee) ,Mission Driven Company that cares about its people,"<button aria-describedby=""cmp-rating-tooltip-1f9hob4kshipq802"" aria-label=""5.0 out of 5 stars."" class=""css-1c33izo e1wnkr790"">5.0</button>",Thrive Market is a mission-driven company that unites like-minded individuals. I am always impressed with the leadership team and how they respond and address feedback from associates.," July 1, 2021"," Los Angeles, CA "
668,Thrive Market,Order Picker (Former Employee) ,You walk too much.,"<button aria-describedby=""cmp-rating-tooltip-1f7v2c331o1cg800"" aria-label=""3.0 out of 5 stars."" class=""css-1c33izo e1wnkr790"">3.0</button>",Management don't give you feedback.  The items are not set up in a logical order.  You have to walk half of the warehouse just to pick up 1 item.  Very tired job.," June 11, 2021"," Sparks, NV "
669,Thrive Market,Manager (Former Employee) ,"Great experience, learned a lot","<button aria-describedby=""cmp-rating-tooltip-1f4tuihsfsa8r800"" aria-label=""4.0 out of 5 stars."" class=""css-1c33izo e1wnkr790"">4.0</button>","Really good experience. Bright, motivated team mates. Free lunch everyday. You get real responsibilities and the opportunity to show you can be trusted. The platform has a positive impact on people's life."," May 5, 2021"," Marina del Rey, CA "
670,Rite Aid,Store Manager (Former Employee) ,Everything was fantastic before Buyout,"<button aria-describedby=""cmp-rating-tooltip-1dg382kmj0mtf000"" aria-label=""3.0 out of 5 stars."" class=""css-1c33izo e1wnkr790"">3.0</button>",Once Walgreens took over the transition period from rite aid to Walgreens was loaded with miscommunications and lack of leadership while corporate wanted you to go in two separate directions.," July 18, 2019"," Hoboken, NJ "
671,Rite Aid,Shift Supervisor (Former Employee) ,Coworker made it fun ,"<button aria-describedby=""cmp-rating-tooltip-1g18d92nug2ct800"" aria-label=""3.0 out of 5 stars."" class=""css-1c33izo e1wnkr790"">3.0</button>","It was okay ,regular retail benefits , go to work do your job and head out. There is room for advancement but it's who you know and your relationship with them"," April 22, 2022"," Hempstead, NY "
672,Rite Aid,Cashier (Current Employee) ,It’s a job,"<button aria-describedby=""cmp-rating-tooltip-1g17svmnhs7f5800"" aria-label=""3.0 out of 5 stars."" class=""css-1c33izo e1wnkr790"">3.0</button>","It’s not what I want to do, but it pays the bills. Coworkers are great, but I’m just looking for my next opportunity. It’s a great place to work if you need to pay the bills"," April 22, 2022"," Alma, GA "
673,Rite Aid,Shift Manager (Former Employee) ,Most boring job ,"<button aria-describedby=""cmp-rating-tooltip-1g16l5bsrpkem801"" aria-label=""2.0 out of 5 stars."" class=""css-1c33izo e1wnkr790"">2.0</button>","Terrible overall, really boring and not worth the $12.50 an hour. And that’s as a shift lead. Cashiers only make $9 and at this point you can make more anywhere. "," April 21, 2022"," Toledo, OH "
674,Rite Aid,Pharmacy Technician (Former Employee) ,great group to work with,"<button aria-describedby=""cmp-rating-tooltip-1g16b0nbhpkem801"" aria-label=""5.0 out of 5 stars."" class=""css-1c33izo e1wnkr790"">5.0</button>",great place to work good people and clean atmosphere  flexible schedule in house training reasonable wage for work performed team approach with employees good managers can't say enough good about them," April 21, 2022"," Towanda, PA "
675,Rite Aid,Assistant Manager (Current Employee) ,"Always busy with projects that allow me to set , create and enjoy productive work. ","<button aria-describedby=""cmp-rating-tooltip-1g168mkpqpkem800"" aria-label=""4.0 out of 5 stars."" class=""css-1c33izo e1wnkr790"">4.0</button>","I enjoy all parts of my job , the ability to work with the public and having a great group of co workers. We , for the most part have a good time, able to laugh and enjoy our day, usually 😋… some days are not so sunshine like!I enjoy the work mostly , resetting ends, setting new products and knowing I made a productive difference at the end of the day."," April 21, 2022"," New Haven, MI "
676,Rite Aid,Cashier (Former Employee) ,Great Manager,"<button aria-describedby=""cmp-rating-tooltip-1g144dmf5s7mm802"" aria-label=""5.0 out of 5 stars."" class=""css-1c33izo e1wnkr790"">5.0</button>","Fun place to work. A lot of room for advancement if you choose to stay. My manager was very flexible with my work schedule, as I was a full time college student. "," April 20, 2022"," Moscow, PA "
677,Rite Aid,Cashier (Current Employee) ,Fun place to work,"<button aria-describedby=""cmp-rating-tooltip-1g129eodtt4e6802"" aria-label=""3.0 out of 5 stars."" class=""css-1c33izo e1wnkr790"">3.0</button>",I love working here! Consistent work schedule and flexible. Managers are great and been here many years. Rite aid has PTO and decent pay range for the work load.," April 19, 2022"," Buffalo, NY "
678,Rite Aid,Cashier (Former Employee) ,It was ok,"<button aria-describedby=""cmp-rating-tooltip-1g126qllum6hr802"" aria-label=""3.0 out of 5 stars."" class=""css-1c33izo e1wnkr790"">3.0</button>","It’s an okay place too work. Not too stressful, not difficult , but not pleasurable either, so yeah it’s okay. The manager was fair, but it wasn’t easy getting an adequate amount of hours , which is why I left "," April 19, 2022"," Klamath Falls, OR "
679,Rite Aid,Pharmacy Technician (Former Employee) ,Good way to get your foot in the door ,"<button aria-describedby=""cmp-rating-tooltip-1g113m69dt4e6802"" aria-label=""3.0 out of 5 stars."" class=""css-1c33izo e1wnkr790"">3.0</button>","I worked at the pharmacy for 2 years, and it truly is a great place to get your foot in the door if you are interested in a job in the pharmacy or medical field in general. I loved my coworkers and the environment overall, but retail isn't for everyone. You will have patients who make you feel better about yourself and the job you're doing, and patients who make you want to pull your hair out. "," April 19, 2022"," Philadelphia, PA "
680,Rite Aid,Cashier (Former Employee) ,Great company ,"<button aria-describedby=""cmp-rating-tooltip-1g0v6bisgghrm802"" aria-label=""5.0 out of 5 stars."" class=""css-1c33izo e1wnkr790"">5.0</button>","I was a cashier at Rite Aid and also do customer service and also I do display, receiving inventory. my job was greatI always love what I do,I also do training for new hiring"," April 18, 2022"," Rochester, NY "
681,Rite Aid,Pharmacy Technician (Current Employee) ,Hours Cut Back,"<button aria-describedby=""cmp-rating-tooltip-1g0spbgimt4i2802"" aria-label=""3.0 out of 5 stars."" class=""css-1c33izo e1wnkr790"">3.0</button>","I was promised full-time as a tech and I end up with hours cut and very little pay. The hours that they give me will never align with a second job, so I have to either stay or go"," April 17, 2022"," Philadelphia, PA "
682,Rite Aid,Shift Supervisor (Current Employee) ,avoid,"<button aria-describedby=""cmp-rating-tooltip-1g0scfu8cm6hr802"" aria-label=""1.0 out of 5 stars."" class=""css-1c33izo e1wnkr790"">1.0</button>","Horrible place!  No management, they mess with your hours, no opportunity for advancement.. Corporate won't even pay for the rolling door to be fixed, so we have to break down pallets in the parking lot & wheel them in.  "," April 17, 2022"," Lake Stevens, WA "
683,Rite Aid,Shift Manager/Cashier (Current Employee) ,Great group of people and every day is different.,"<button aria-describedby=""cmp-rating-tooltip-1g0o7usl9t4ji800"" aria-label=""3.0 out of 5 stars."" class=""css-1c33izo e1wnkr790"">3.0</button>","A good place to work for part-time employment or to gain experience in the retail sector. The benefits are decent but the pay is not adequate for a full-time position, considering the job responsibilities."," April 15, 2022"," Doylestown, PA "
684,Rite Aid,Pharmacist (Former Employee) ,Lost corporation. Over their heads,"<button aria-describedby=""cmp-rating-tooltip-1g0ngbsqcg2f3800"" aria-label=""2.0 out of 5 stars."" class=""css-1c33izo e1wnkr790"">2.0</button>",The stores are not staffed and organized to meet the service needs of their customers and patients. One pharmacist (without a technician) cannot fulfill all of the tasks. It seems like corporate doesn’t have the answers; I don’t think that they know what the questions are either. Most of the stores that I worked in managed to function competently. It’s a good thing that they sold or closed most of their stores.," April 15, 2022"," Quitman, GA "
685,Rite Aid,Cashier (Current Employee) ,Ok. Pay isn’t fair.,"<button aria-describedby=""cmp-rating-tooltip-1g0le877hocj5800"" aria-label=""3.0 out of 5 stars."" class=""css-1c33izo e1wnkr790"">3.0</button>","I adore the store manager of my location. The annual raises, which are out of management’s control at that point, are not quite fair. The customers are very nice at my store. The only frustration I have is compensation for my time, and benefits are not reasonable considering the cost of today’s living."," April 14, 2022"," Saint Marys, OH "
686,Rite Aid,Cashier (Former Employee) ,Wish it hadn't closed ,"<button aria-describedby=""cmp-rating-tooltip-1g0i60bhpgsqf801"" aria-label=""5.0 out of 5 stars."" class=""css-1c33izo e1wnkr790"">5.0</button>",This company closed but it really taught me a lot I'm not sure how they were bought out but they didn't lay anyone off or anything. Just keep your head up and you can get promoted from within the company.," April 13, 2022"," Denver, CO "
687,Rite Aid,Lead Registered Nurse Covid19 Vaccine Immunizer (Former Employee) ,"Great pay, great hours","<button aria-describedby=""cmp-rating-tooltip-1g0g1jaaqg2f3800"" aria-label=""5.0 out of 5 stars."" class=""css-1c33izo e1wnkr790"">5.0</button>","Overall great pay & great hours.  Good team when staffed appropriately.  Managers at the store were all awesome...was sad to leave this position, but moved out if city."," April 12, 2022"," Santa Maria, CA "
688,Rite Aid,Pharmacy Technician (Former Employee) ,"Always work to do, understanding management but low pay","<button aria-describedby=""cmp-rating-tooltip-1g0dbg3ilghrm802"" aria-label=""3.0 out of 5 stars."" class=""css-1c33izo e1wnkr790"">3.0</button>",There is not a lot of room for advancement here. The pay is not enough for the people you deal with. Including fellow employees. The hours do not allow for much work life balance but my manager was always willing to work with me. ," April 11, 2022"," Altoona, PA "
689,Rite Aid,Assistant Manager (Former Employee) ,Local,"<button aria-describedby=""cmp-rating-tooltip-1g0a4drdrk24g800"" aria-label=""3.0 out of 5 stars."" class=""css-1c33izo e1wnkr790"">3.0</button>","Local customers. Great atmosphere. Nice people to work with and flexible work hours, we can switch schedules as long as shift is covered. We can cont on others to know several positions and that helps with flexability."," April 10, 2022"," Tonawanda, NY 14223 "
