,company,Designation,title,rating,review,date,Place
333,Neustar,Sales Development Representative (Current Employee) ,Fantastic culture. ,"<button aria-describedby=""cmp-rating-tooltip-1fs5iou8cjp30802"" aria-label=""5.0 out of 5 stars."" class=""css-1c33izo e1wnkr790"">5.0</button>","The culture at Neustar is great. Compensation has been fair, generally, and improving. Hybrid work environment since covid. I recommend Neustar to any job seekers out there (whether that be sales or a different role). "," February 17, 2022"," Sterling, VA "
334,Neustar,Senior Software Engineer (Former Employee) ,Disaster,"<button aria-describedby=""cmp-rating-tooltip-1fk0748j5nq0m802"" aria-label=""2.0 out of 5 stars."" class=""css-1c33izo e1wnkr790"">2.0</button>","- Executive leadership over the years has led to a significant amount of brain drain.- Initiatives that serve to make certain leaders good take precedent over ones that actually make money, keep the system in shape, and retain customers.- Focus on saving money makes it impossible to do things correctly and quickly, leading to technical debt, inability to get things done, and burnout.With that said, things were very much focused on EBITDA in recent years in order to sell the company for a nice profit;  it's possible things will change with the new acquisition."," November 8, 2021", San Diego 
335,Neustar,Senior Facilities Supervisor (Former Employee) ,Productive and fun place to work. ,"<button aria-describedby=""cmp-rating-tooltip-1f5kjpchku2n1800"" aria-label=""5.0 out of 5 stars."" class=""css-1c33izo e1wnkr790"">5.0</button>","It’s a company that aims to becoming very diversified and inclusive, cares for the health/wellness. Neustar is a family first company. When the COVID-19 outbreak started, the top executives did not hesitate to closedown. "," May 13, 2021"," Sterling, VA "
336,Neustar,Manager (Current Employee) ,Fast growing company with exceptional products and great client list. ,"<button aria-describedby=""cmp-rating-tooltip-1ek7611bmt3qj800"" aria-label=""5.0 out of 5 stars."" class=""css-1c33izo e1wnkr790"">5.0</button>",Fast growing company with exceptional products and great client list. I have been with Neustar for 4.5 years and and I am happy with my career trajectory.  ," October 9, 2020"," New York, NY "
337,Neustar,Solutions Engineer (Former Employee) ,Productive and fun workplace,"<button aria-describedby=""cmp-rating-tooltip-1ea60psubraok800"" aria-label=""5.0 out of 5 stars."" class=""css-1c33izo e1wnkr790"">5.0</button>","Spent good amount of time at Neustar and learnt a lot. The best part of my job was my team !!!! Overall, had a great time and made some good friends.."," June 6, 2020"," Sterling, VA "
338,Neustar,Staff QA Engineer (Current Employee) ,Very Good Work Environment,"<button aria-describedby=""cmp-rating-tooltip-1e9rp9qvaobrr800"" aria-label=""4.0 out of 5 stars."" class=""css-1c33izo e1wnkr790"">4.0</button>",Team effort and understanding is very good. Management keeps the employees with up to date information. Benefits are amazing and every member is Neustar is so friendly.," June 2, 2020"," San Francisco, CA "
339,Neustar,Serving as a Digital Project Manager (Current Employee) ,project manager,"<button aria-describedby=""cmp-rating-tooltip-1e6ufgd064ojt800"" aria-label=""5.0 out of 5 stars."" class=""css-1c33izo e1wnkr790"">5.0</button>",working as a project manager and enjoying my role. work and persona life is balanced...good people around to work with...great company...believes in the employees," April 27, 2020"," New York, NY "
340,Neustar,Hadoop Administrator (Former Employee) ,productive,"<button aria-describedby=""cmp-rating-tooltip-1e4uud4d0on6m803"" aria-label=""5.0 out of 5 stars."" class=""css-1c33izo e1wnkr790"">5.0</button>","Good culture, good learning exposure. Management is very helpful, an opportunity to work on multiple technologies. Would like to suggest to work for this organisation."," April 2, 2020"," Sterling, VA "
341,Neustar,Technical Project Manager (Former Employee) ,Incredible smart people doing really great work,"<button aria-describedby=""cmp-rating-tooltip-1e4ani7ed4ru6802"" aria-label=""3.0 out of 5 stars."" class=""css-1c33izo e1wnkr790"">3.0</button>","The data Neustar collects is invaluable. In the wrong hands, it has a price tag for marketing purposes. In the wrong hands, it has the power to do things that are unsavory."," March 26, 2020"," San Francisco, CA "
342,Neustar,Network Operations Center Analyst (Former Employee) ,kind people doing a variety of work,"<button aria-describedby=""cmp-rating-tooltip-1e17q3muo38j7001"" aria-label=""4.0 out of 5 stars."" class=""css-1c33izo e1wnkr790"">4.0</button>","A typical day at work depends on your position but will generally be one of a few things. most people have to manage the data center, or recieve tickets, this job was 5 years ago and i barely remember it, expect that it was a good internship, and i wish i would've asked for a permanent position sooner"," February 16, 2020"," Sterling, VA "
343,Neustar,Sales Director (Former Employee) ,Great company with great solutions,"<button aria-describedby=""cmp-rating-tooltip-1e1084k6u38j7002"" aria-label=""5.0 out of 5 stars."" class=""css-1c33izo e1wnkr790"">5.0</button>",Excellent company to work for.  Great for someone with experience and provides for promotion options.   Very process oriented and easy to work with bunch," February 13, 2020"," New York, NY "
344,Neustar,Manager (Former Employee) ,company is in transition,"<button aria-describedby=""cmp-rating-tooltip-1e0ftcu3iq45d803"" aria-label=""2.0 out of 5 stars."" class=""css-1c33izo e1wnkr790"">2.0</button>",company is in transition and will take time to turn ship around. Benefits are average and need to work on increasing the days work from home policy and work life balance.," February 7, 2020"," Sterling, VA "
345,Neustar,Senior NOC Analyst / Network Operation Engineer (Former Employee) ,Fun place to work and lot to learn,"<button aria-describedby=""cmp-rating-tooltip-1du0fch4c4rln801"" aria-label=""4.0 out of 5 stars."" class=""css-1c33izo e1wnkr790"">4.0</button>","Nice place to work with diversity and good learning atmosphere The management is good . I enjoyed working at Neustar but after about 15 years, I decided to move on and experience a new place and to contribute my experience to a new company and grow."," January 7, 2020"," Sterling, VA "
346,Neustar,Data Engineer (Former Employee) ,Relaxed and fun place with ping pong table at work,"<button aria-describedby=""cmp-rating-tooltip-1drjmsldk0kbp003"" aria-label=""3.0 out of 5 stars."" class=""css-1c33izo e1wnkr790"">3.0</button>","Most of the daily work is mostly repetitive with continuous new developments (as proof of concept) happening if you wish to participate . Management is okay-ish, I never had a chance to interact much, not that they are unavailable but I never felt the pressing need to approach them. Workplace culture is relaxed and friendly, You can show up in a jeans and t-shirt and it is still okay."," December 8, 2019"," Los Angeles, CA "
347,Neustar,Associate Information Security Engineer Intern (Current Employee) ,Amazing experience and very happy I got the chance!,"<button aria-describedby=""cmp-rating-tooltip-1dr66pg0v1d02003"" aria-label=""5.0 out of 5 stars."" class=""css-1c33izo e1wnkr790"">5.0</button>","I am very happy that I got the opportunity to work at Neustar, Inc. I am thankful for it because I was able to meet some incredible people with so much experience. Everyone was wonderful and they were all willing to help. My seniors always ensured that I understood the tasks that were given to me and always gave feedback on my performance so I could learn and continue to grow. I am very glad that I got this opportunity makes me feel truly blessed."," December 3, 2019"," Sterling, VA "
348,Neustar,Unknown (Current Employee) ,The company is not doing well,"<button aria-describedby=""cmp-rating-tooltip-1dp73b0565j53800"" aria-label=""1.0 out of 5 stars."" class=""css-1c33izo e1wnkr790"">1.0</button>","In overall, the company is not doing well. A lot of changes in the management and they lie at the time of hiring. Manager is extremely workaholic and expect the same from others."," November 8, 2019"," Sterling, VA "
349,Neustar,Director of Software Engineering (Former Employee) ,If you can’t get another job ... sure,"<button aria-describedby=""cmp-rating-tooltip-1dorna9g6b8ai802"" aria-label=""3.0 out of 5 stars."" class=""css-1c33izo e1wnkr790"">3.0</button>",One of the worst places to work at  in the SF Bay Area. Executive team was clueless and politics was more important than quality of the people. The atmosphere was toxic and deeply distrustful. HR was pathetic and so was any norm of working. I would not wish it even to my enemies," November 4, 2019"," San Francisco, CA "
350,Neustar,PRINCIPAL ACCOUNT MANAGER (Current Employee) ,OK Sales Gig,"<button aria-describedby=""cmp-rating-tooltip-1do9gqkcnh3ll803"" aria-label=""3.0 out of 5 stars."" class=""css-1c33izo e1wnkr790"">3.0</button>","They are a bit disjointed but they have good people that work here. Not micro-managed which is nice but the product can be a difficult sell and they are very secular.  Each business division is separated from each other. Security, Risk, Marketing, Communications all work in separate teams and do not collaborate. You have to sell on your own, learn on your own."," October 28, 2019"," Sterling, VA "
351,Neustar,Director (Current Employee) ,Great management team,"<button aria-describedby=""cmp-rating-tooltip-1djpekcri5j5v800"" aria-label=""5.0 out of 5 stars."" class=""css-1c33izo e1wnkr790"">5.0</button>",Collaborative team environment where people are looking to achieve goals. Great management team that has reset the direction of the company.  Great level of transparency amongst teams.  Not a political environment.," September 2, 2019"," Sterling, VA "
352,Neustar,Information & Network Security Intern (Current Employee) ,Great Place to get started,"<button aria-describedby=""cmp-rating-tooltip-1de2km1utb88o800"" aria-label=""5.0 out of 5 stars."" class=""css-1c33izo e1wnkr790"">5.0</button>","When I got started in Information Technology/Cyber Security through the Year Up Program(https://www.yearup.org/), I learned a phenomenal amount of concepts, subjects, and even hands-on experience through a 6-month experience. It's a great place to network and grow as the company overall is quite large, and there's many methods of promotion and especially getting started in Information Technology, Cyber Security, and much more."," June 23, 2019"," Sterling, VA "
353,Nordstrom,Department Manager (Former Employee) ,retail working,"<button aria-describedby=""cmp-rating-tooltip-1bpbojru752tg9nj"" aria-label=""4.0 out of 5 stars."" class=""css-1c33izo e1wnkr790"">4.0</button>",great time working there very stressful always seemed to be at work never home great way to gain a career i enjoyed being busy stressful dealing with customers constantly little down time," September 6, 2017"," Bergen, NJ "
354,Nordstrom,Sales Associate (Former Employee) ,Environment ,"<button aria-describedby=""cmp-rating-tooltip-1g1ef9iblg2fh802"" aria-label=""5.0 out of 5 stars."" class=""css-1c33izo e1wnkr790"">5.0</button>",Good environment they want you to rise higher. You’re able to cross sell with your customers and create the experience they want to have. They do promote and want you to grow within.," April 24, 2022", Michigan 
355,Nordstrom,Warehouse Associate (Former Employee) ,"yeah sstifs maybe lack of just a thing, good place to work","<button aria-describedby=""cmp-rating-tooltip-1g1c52gfgs7eh800"" aria-label=""5.0 out of 5 stars."" class=""css-1c33izo e1wnkr790"">5.0</button>","I don't really know there was stuff, and eventually it stopped. But then there was more stuff to take it's place. It's hard to imagine what happens. Is this reaching you? Yeah. The other side is calling, but it's hard to understand when there are clothes. You know. Overall work life balance is ok, and management are good. Training was good, and I eventually developed a skill."," April 23, 2022"," Elizabethtown, PA "
356,Nordstrom,Transportation Specialist (Former Employee) ,"Management was terrible, communication was lacking, training is laughable.","<button aria-describedby=""cmp-rating-tooltip-1g1ajrr8ug2ct802"" aria-label=""2.0 out of 5 stars."" class=""css-1c33izo e1wnkr790"">2.0</button>","The best part about the job is the pay, other than that if you do your job and do it well? Expect to be treated like a manager with none of the pay but all of the responsibilities. Turn over was higher than snoop dogg."," April 23, 2022"," Elizabethtown, PA "
357,Nordstrom,Cashier  (Former Employee) ,"Excellent, inclusive work environment.","<button aria-describedby=""cmp-rating-tooltip-1g19q6p9jnpki801"" aria-label=""5.0 out of 5 stars."" class=""css-1c33izo e1wnkr790"">5.0</button>",I was a cashier for a few years. Loved my time with the company . Met a lot of great people along the way as well.  There is a ton of room for growth. ," April 22, 2022"," Paramus, NJ "
358,Nordstrom,Sales Associate (Current Employee) ,fun workplace,"<button aria-describedby=""cmp-rating-tooltip-1g175jbgenq3m800"" aria-label=""5.0 out of 5 stars."" class=""css-1c33izo e1wnkr790"">5.0</button>",ProsCommission based environment so you are totally driving your own pay check and building your own business. If you work hard you definitely reap the returns.Team: our team was a total family. We had an awesome department and we all took care of each other. This isn't common within commission structures so it was pretty awesomeSuper high energy. You're always meeting new people and networking. You're working with the most amazing designersConsCompany is doing massive management changes. Lots going on within the company and the full-line stores are definitely last priority at the moment.Recently changed commission structure as well.Our manager went though three assistant and an entire year of 10-15 year veterans in less than a year and a half of taking position. This went unrecognized.Extremely hard to work your way into high level positions (restrictions)," April 21, 2022"," Mission Viejo, CA "
359,Nordstrom,Business Manager (Former Employee) ,Not an environment for single moms ,"<button aria-describedby=""cmp-rating-tooltip-1g16h288is7l7802"" aria-label=""1.0 out of 5 stars."" class=""css-1c33izo e1wnkr790"">1.0</button>","At Nordstrom they want you to dedicate your life to their company and not be compensated properly. They want you to work nights weekends holidays and not be able to take time off to care for your children. They don’t offer raises, overtime, sick time, or a work life balance. Should’ve stayed with Macys! "," April 21, 2022"," Edison, NJ "
360,Nordstrom,Loss Prevention Agent (Former Employee) ,It was a very fast pace external driven company.,"<button aria-describedby=""cmp-rating-tooltip-1g16abqo837np001"" aria-label=""4.0 out of 5 stars."" class=""css-1c33izo e1wnkr790"">4.0</button>",It was a fast paced environment. The management supported their associates. They have very strict directives that can make it hard to successfully apprehend shoplifter. They seem to struggle on fixing camera equipment needed to keep surveillance of individuals in the store.," April 21, 2022"," Winter Park, FL "
361,Nordstrom,Sales Associate (Former Employee) ,I found the management unqualified to hold their positions,"<button aria-describedby=""cmp-rating-tooltip-1g14mhst4gsq6800"" aria-label=""4.0 out of 5 stars."" class=""css-1c33izo e1wnkr790"">4.0</button>","I do not recommend Nordstrom as a company to work for. Many of the positions are straight sales without sales tools, The management was promoted not on skills but years with the company."," April 20, 2022"," Los Angeles, CA "
362,Nordstrom,Sales Associate (Former Employee) ,fun place to work  discount on clothes ,"<button aria-describedby=""cmp-rating-tooltip-1g13tkbnqsa32801"" aria-label=""1.0 out of 5 stars."" class=""css-1c33izo e1wnkr790"">1.0</button>",sales job. employee are great! customer are great. you have to work weekends and holidays. not a lot of work/ life balance.working holidays sucks miss family functions ," April 20, 2022"," King of Prussia, PA "
363,Nordstrom,Sales Associate (Former Employee) ,Great opportunity if you are a hard worker,"<button aria-describedby=""cmp-rating-tooltip-1g12as41sg2f3800"" aria-label=""4.0 out of 5 stars."" class=""css-1c33izo e1wnkr790"">4.0</button>","Being on commission, you have the ability to make your own pay depending on how much you sell. You also can sell in any department so the stuff you can sell is endless "," April 19, 2022"," Chicago, IL "
364,Nordstrom,Assistant Manager Stock Control (Former Employee) ,Work to do to make it a good place to work. ,"<button aria-describedby=""cmp-rating-tooltip-1g1184qtjghrm800"" aria-label=""3.0 out of 5 stars."" class=""css-1c33izo e1wnkr790"">3.0</button>","I loved my job in itself. I had a great team of associates and the managers that I talked to on a daily basis were helpful and supportive. As an Area Manager, you will be expected to basically run all operations in your area of responsibility. Operations Managers do very little and love to delegate and hold their Area Managers accountable for everything. We rarely had enough resources available for all our employees to be successful and we rarely focused on actual meaningful things for our employees. Until some changes are made in upper management, Nordstrom is not a place I would recommend to anyone. Management was really cliqued up and if you aren't part of the ""in crowd"" you will go nowhere and not be recognized for your hard work. "," April 19, 2022"," Elizabethtown, PA "
365,Nordstrom,Sales Associate/Web (Former Employee) ,Easy and engaging,"<button aria-describedby=""cmp-rating-tooltip-1g10tto0kt4e6802"" aria-label=""5.0 out of 5 stars."" class=""css-1c33izo e1wnkr790"">5.0</button>","Work life is balanced as they work with your schedule, never stressed on the job. Pay was average, work was average, days were average. Nothing was ever new but nothing was ever hard."," April 19, 2022", Massachusetts 
366,Nordstrom,Security Ambassador (Former Employee) ,OK for a temporary thing not long term ,"<button aria-describedby=""cmp-rating-tooltip-1g0uvmn6bocj5800"" aria-label=""1.0 out of 5 stars."" class=""css-1c33izo e1wnkr790"">1.0</button>",As a security ambassador at the San jose location you will constantly be shined on with growth and opportunities  but these will not come growth is only for those that are friends of managers here. ," April 18, 2022"," San Jose, CA "
367,Nordstrom,Nordstrom Packager and Stockroom  (Former Employee) ,Overall Good Job,"<button aria-describedby=""cmp-rating-tooltip-1g0segjout4e6802"" aria-label=""4.0 out of 5 stars."" class=""css-1c33izo e1wnkr790"">4.0</button>","If I’m being honest, the job was great! Nothing too tedious or back breaking. It’s obviously a job, so you’re gonna have some moments of tiredness, but overall environment is very chill."," April 17, 2022"," New York, NY "
368,Nordstrom,Logistics Processor (Former Employee) ,Good job,"<button aria-describedby=""cmp-rating-tooltip-1g0rfatf3g2f3802"" aria-label=""5.0 out of 5 stars."" class=""css-1c33izo e1wnkr790"">5.0</button>",It’s a pretty nice job but I do wish they trained me more thoroughly and gave me a flexible work schedule but other than that it was a really good job. It’s super easy.," April 17, 2022"," Denver, CO "
369,Nordstrom,Logistics Processor (Former Employee) ,Good first job,"<button aria-describedby=""cmp-rating-tooltip-1g0qe5p8jt4ji800"" aria-label=""4.0 out of 5 stars."" class=""css-1c33izo e1wnkr790"">4.0</button>","Good first job, most managers will work with your hours and are flexible. Of course it is different based on location and who the actual managers are."," April 16, 2022"," New York, NY "
370,Nordstrom,Cleaner (Former Employee) ,It depends on what location and who is your manager,"<button aria-describedby=""cmp-rating-tooltip-1g0qarargm6hr802"" aria-label=""2.0 out of 5 stars."" class=""css-1c33izo e1wnkr790"">2.0</button>",I've been working with them on and off and honestly I can say it's a pretty decent company It depends again who is your manager and who you work with as well as a location that you're working at It can be a good experience for you if it happens to be that and if not it's just a decent discount and can connect with people to get into different fields," April 16, 2022"," Newport Beach, CA "
371,Nordstrom,logistics (Former Employee) ,very flexible work place that has many opportunities to grow. And very cultured diversed ,"<button aria-describedby=""cmp-rating-tooltip-1g0pivduot4i2801"" aria-label=""5.0 out of 5 stars."" class=""css-1c33izo e1wnkr790"">5.0</button>",very flexible job can get overwhelming sometimes but very cultured. Has many different opportunities to grow within the company also the pay is great as well.," April 16, 2022"," Atlanta, GA "
372,Nordstrom,Studio Services Coordinator (Former Employee) ,"Good employee discount, opportunity to move around to different locations ","<button aria-describedby=""cmp-rating-tooltip-1g0pfqt7rm6hr802"" aria-label=""4.0 out of 5 stars."" class=""css-1c33izo e1wnkr790"">4.0</button>","Worked here for 8 years, in a myriad of jobs. The pay never really changes after a certain point, management tends to make impulse decisions on rolling out new processes without extra staffing, and then back pedaling later."," April 16, 2022"," Glendale, CA "
373,Nordstrom,Sales Associate (Former Employee) ,Productive fun work environment! ,"<button aria-describedby=""cmp-rating-tooltip-1g0p9975qg2f3802"" aria-label=""4.0 out of 5 stars."" class=""css-1c33izo e1wnkr790"">4.0</button>",Started off in retail and this was a good fit and place for me to begin at. Everyone is very friendly I got to work with and supportive of each other. ," April 16, 2022"," New York, NY "
374,PayPal,QA/ Tester (Current Employee) ,its nice to work here,"<button aria-describedby=""cmp-rating-tooltip-1ajq0va7mb822f6a"" aria-label=""3.0 out of 5 stars."" class=""css-1c33izo e1wnkr790"">3.0</button>",the company is good and employees are so fantastic & friendly. working there is very enjoyable the payment terms are very clear.," May 27, 2016"," New York, NY "
375,PayPal,Customer Solutions Specialist (Current Employee) ,…Okay,"<button aria-describedby=""cmp-rating-tooltip-1g1bq535cg2ct802"" aria-label=""2.0 out of 5 stars."" class=""css-1c33izo e1wnkr790"">2.0</button>",It definitely gets overwhelmingly busy majority of the time. The job definitely leaves you feeling mentally drained at the end of the day/work week.. ," April 23, 2022"," Omaha, NE "
376,PayPal,Customer Solutions Specialist (Former Employee) ,25 cent soda,"<button aria-describedby=""cmp-rating-tooltip-1g14oe47dmsai801"" aria-label=""3.0 out of 5 stars."" class=""css-1c33izo e1wnkr790"">3.0</button>","Soda is cheap and helps one get thru a very long day.If you ever have a sister that gets sick, you can not apply for a Fmla. Because a sister is not family.  This is no joke"," April 20, 2022"," Chandler, AZ "
377,PayPal,"""TEX Agent"" (Former Employee) ",Corporate Structure that will underpay you,"<button aria-describedby=""cmp-rating-tooltip-1fu0pu1hhm6j7800"" aria-label=""1.0 out of 5 stars."" class=""css-1c33izo e1wnkr790"">1.0</button>","I really wanted this to be my career but PayPal did not make that easy. I don't want to make this long. Basically I was promised promotions, raises, schedule flexibility and was given non of that. If you're entry level you can start here but if you're looking for a career you better have a degree and only settle for what you think you deserve. Once they set your salary/hourly and schedule that's it for you."," March 12, 2022"," Chandler, AZ "
378,PayPal,Sr. Agent (Former Employee) ,They lost focus along the way,"<button aria-describedby=""cmp-rating-tooltip-1ft5q92dh33im000"" aria-label=""3.0 out of 5 stars."" class=""css-1c33izo e1wnkr790"">3.0</button>",the company itself was really good at the beginning. However they neglected employees that had been with the company for many years. Although you must keep stakeholders happy you also must keep internal employees happy and foster a conducive work environment. They failed in this area. ," March 2, 2022"," Chandler, AZ "
379,PayPal,Collections Agent (Former Employee) ,It's what you make of it,"<button aria-describedby=""cmp-rating-tooltip-1fsonco1co15g800"" aria-label=""2.0 out of 5 stars."" class=""css-1c33izo e1wnkr790"">2.0</button>","There is no flexibility in hours worked, solid 40 hours every week and you have to be there on the dot.Management has to play a charade of caring for you while meeting their own quotas which made me feel as well as other coworkers, like nothing was changing or being addressedI learned a lot there but you could not pay me to go back"," February 25, 2022"," Chandler, AZ "
380,PayPal,Dispute Resolutions Specialist (Former Employee) ,"Inclusive, good benefits but severely underpaid for work performed","<button aria-describedby=""cmp-rating-tooltip-1fsh8skjro1ji802"" aria-label=""2.0 out of 5 stars."" class=""css-1c33izo e1wnkr790"">2.0</button>","Pros: Very inclusive, good benefits, good cultureCons: Very demanding job, poor training, salary/hourly pay way too low for what you do, constantly being given more tasks/duties than original job description without appropriate compensation (""lateral moves"")"," February 22, 2022"," Chandler, AZ "
